{
  "$schema": "../schema/requirement-evidence.schema.json",
  "schema_version": 1,
  "requirement_id": "API-01",
  "matrix_statement_sha256": "f36363b7ca1eb49c6b8d7839c37a2b36b0aed6cf5a2af07ca638206ff9cd5c45",
  "evidence_class": "product",
  "scope": {
    "allowed_path_globs": [
      "apps/api/src/marketing_agents/api/app.py",
      "apps/api/src/marketing_agents/api/dependencies.py",
      "apps/api/src/marketing_agents/api/routes/health.py",
      "apps/api/src/marketing_agents/application/ports/readiness.py",
      "apps/api/src/marketing_agents/infrastructure/readiness.py",
      "docs/implementation-plan/16-requirements-traceability-matrix.md",
      "docs/verification/requirements/API-01.json",
      "docs/verification/requirements/API-01.md",
      "tests/integration/api/test_api_01_health_readiness.py"
    ],
    "required_path_groups": [
      {
        "kind": "implementation",
        "one_of": [
          "apps/api/src/marketing_agents/api/routes/health.py",
          "apps/api/src/marketing_agents/application/ports/readiness.py",
          "apps/api/src/marketing_agents/infrastructure/readiness.py"
        ]
      },
      {
        "kind": "test",
        "one_of": [
          "tests/integration/api/test_api_01_health_readiness.py"
        ]
      }
    ]
  },
  "claims": [
    {
      "id": "process-only-liveness",
      "type": "contract",
      "statement": "GET /health/live remains an exact typed process signal and never resolves or invokes readiness, so a missing, failed, or throwing readiness dependency cannot turn liveness into a database, catalog, registry, or startup check.",
      "test_refs": [
        "tests/integration/api/test_api_01_health_readiness.py::test_api_01_liveness_never_invokes_readiness_probe",
        "tests/integration/api/test_api_01_health_readiness.py::test_api_01_missing_probe_fails_closed_without_breaking_liveness"
      ]
    },
    {
      "id": "typed-readiness-contract",
      "type": "contract",
      "statement": "GET /health/ready recomputes six fixed ordered internal checks and returns the same typed no-store projection for both outcomes: 200 only when every check is ready and 503 when any represented check is not ready. OpenAPI declares the shared 200 and 503 schema.",
      "test_refs": [
        "tests/integration/api/test_api_01_health_readiness.py::test_api_01_ready_returns_exact_typed_no_store_projection",
        "tests/integration/api/test_api_01_health_readiness.py::test_api_01_openapi_declares_stable_typed_200_and_503_contracts",
        "tests/integration/api/test_api_01_health_readiness.py::test_api_01_readiness_is_recomputed_and_not_cached",
        "tests/integration/api/test_api_01_health_readiness.py::test_api_01_dependency_failure_returns_503_and_liveness_stays_up"
      ]
    },
    {
      "id": "fail-closed-sanitized-readiness",
      "type": "negative_control",
      "statement": "An absent or malformed probe, a probe exception containing private database, credential, or path text, and a bounded probe timeout all yield deterministic typed 503 output with stable codes, no raw cause, and Cache-Control no-store rather than a 500 or cached fallback.",
      "test_refs": [
        "tests/integration/api/test_api_01_health_readiness.py::test_api_01_missing_probe_fails_closed_without_breaking_liveness",
        "tests/integration/api/test_api_01_health_readiness.py::test_api_01_probe_exception_is_sanitized_and_not_cached",
        "tests/integration/api/test_api_01_health_readiness.py::test_api_01_timeout_and_malformed_report_fail_closed",
        "tests/integration/api/test_api_01_health_readiness.py::test_api_01_blocking_catalog_io_is_offloaded_and_times_out"
      ]
    },
    {
      "id": "read-only-local-probes",
      "type": "negative_control",
      "statement": "The local probe checks existing database connectivity plus mapped worker columns, types, defaults, keys, constraints, and indexes without creating or changing the SQLite file; compiles exact 5/12/36/43 catalog metadata; and validates deterministic registries without invoking them. Missing migration-head and persisted-seed verification remain explicitly not ready.",
      "test_refs": [
        "tests/integration/api/test_api_01_health_readiness.py::test_api_01_file_backed_sqlite_probe_is_read_only_and_restart_stable",
        "tests/integration/api/test_api_01_health_readiness.py::test_api_01_absent_database_is_not_created_by_readiness",
        "tests/integration/api/test_api_01_health_readiness.py::test_api_01_unwritable_database_directory_has_specific_safe_code",
        "tests/integration/api/test_api_01_health_readiness.py::test_api_01_wrong_worker_column_types_are_incompatible",
        "tests/integration/api/test_api_01_health_readiness.py::test_api_01_missing_worker_constraints_are_incompatible",
        "tests/integration/api/test_api_01_health_readiness.py::test_api_01_local_probe_reports_schema_catalog_and_registry_failures"
      ]
    }
  ],
  "gates": [
    {
      "id": "api-01-health-readiness",
      "runner": "argv",
      "argv": [
        "uv",
        "run",
        "pytest",
        "-q",
        "tests/integration/api/test_api_01_health_readiness.py",
        "tests/integration/api/test_arch_01_health.py",
        "tests/security/test_safe_01_default_mock_mode.py",
        "tests/catalog/test_del_02_validated_catalog_release.py",
        "tests/unit/architecture/test_arch_05_framework_boundaries.py",
        "tests/integration/db/test_arch_03_portable_database.py"
      ],
      "cwd": ".",
      "timeout_seconds": 600,
      "network_requirement": "deny",
      "covers": [
        "process-only-liveness",
        "typed-readiness-contract",
        "fail-closed-sanitized-readiness",
        "read-only-local-probes"
      ]
    }
  ],
  "connection_witness": {
    "implementation_path_globs": [
      "apps/api/src/marketing_agents/api/app.py",
      "apps/api/src/marketing_agents/api/dependencies.py",
      "apps/api/src/marketing_agents/api/routes/health.py",
      "apps/api/src/marketing_agents/application/ports/readiness.py",
      "apps/api/src/marketing_agents/infrastructure/readiness.py"
    ],
    "gate_id": "api-01-health-readiness"
  },
  "limitations": [
    "API-01 verifies the health transport and read-only fail-closed aggregation boundary. DEL-04 still owns Alembic revisions, deployed-head verification, catalog projection tables, transactional seeding, and database-versus-source catalog parity; current mapped-table compatibility is not described as migration currency.",
    "Until DEL-04 supplies migration-head and persisted-catalog parity checks, the default local probe truthfully reports those checks not ready. A fully composed injected probe can exercise the documented 200 response without weakening the default.",
    "The response proves one instantaneous set of internal checks. It is not proof of continuous availability, successful worker execution, or external provider and connector reachability.",
    "Readiness does not migrate, seed, repair, create a digest key, call a model provider or connector, or perform an external-network probe.",
    "File-backed SQLite is exercised. PostgreSQL runtime readiness, migration parity, and contention are not exercised.",
    "Worker process health, scheduler polling and metrics, Compose health checks, and startup ordering remain Plan 15 and DEL-05 scope."
  ]
}
